{
  "assessor": {
    "name": "agentic-dev",
    "version": "0.15.0+dev"
  },
  "dimensions": {
    "performance": {
      "failed": 0,
      "not_applicable": 0,
      "passed": 2,
      "unknown": 0
    },
    "security": {
      "failed": 2,
      "not_applicable": 1,
      "passed": 3,
      "unknown": 1
    }
  },
  "document_type": "agentic.readiness-assessment",
  "maturity": {
    "current": "structured",
    "current_rank": 2,
    "levels": [
      {
        "achieved": true,
        "blocking": [],
        "failed": 0,
        "id": "unaware",
        "not_applicable": 0,
        "passed": 0,
        "rank": 0,
        "required": 0,
        "title": "Unaware",
        "unknown": 0
      },
      {
        "achieved": true,
        "blocking": [],
        "failed": 0,
        "id": "foundational",
        "not_applicable": 0,
        "passed": 5,
        "rank": 1,
        "required": 5,
        "title": "Foundational",
        "unknown": 0
      },
      {
        "achieved": true,
        "blocking": [],
        "failed": 0,
        "id": "structured",
        "not_applicable": 1,
        "passed": 10,
        "rank": 2,
        "required": 11,
        "title": "Structured",
        "unknown": 0
      },
      {
        "achieved": false,
        "blocking": [
          "constraints.architecture_boundaries"
        ],
        "failed": 0,
        "id": "optimized",
        "not_applicable": 1,
        "passed": 1,
        "rank": 3,
        "required": 3,
        "title": "Optimized",
        "unknown": 1
      },
      {
        "achieved": false,
        "blocking": [
          "context.contribution_workflow",
          "feedback.agent_effectiveness",
          "feedback.ci.security"
        ],
        "failed": 2,
        "id": "autonomous",
        "not_applicable": 0,
        "passed": 2,
        "rank": 4,
        "required": 5,
        "title": "Autonomous",
        "unknown": 1
      }
    ],
    "next": "optimized",
    "target": "optimized",
    "target_blockers": [
      "constraints.architecture_boundaries"
    ],
    "target_met": false,
    "target_rank": 3
  },
  "pillars": {
    "constraints": {
      "failed": 1,
      "not_applicable": 1,
      "passed": 4,
      "unknown": 2
    },
    "context": {
      "failed": 4,
      "not_applicable": 1,
      "passed": 8,
      "unknown": 0
    },
    "conventions": {
      "failed": 1,
      "not_applicable": 0,
      "passed": 4,
      "unknown": 0
    },
    "feedback": {
      "failed": 3,
      "not_applicable": 0,
      "passed": 5,
      "unknown": 1
    }
  },
  "repository": {
    "name": "agentic-dev",
    "revision": "85ce476b232e7eac6f18c5c843a517cef1ae3ec3"
  },
  "requirements": [
    {
      "applicability": null,
      "depends_on": [],
      "dimension": "security",
      "evidence": [],
      "id": "constraints.agent_permissions",
      "missing_evidence": [
        "agent.permissions"
      ],
      "pillar": "constraints",
      "reason": "Agent permissions may be enforced at user or organization scope, outside the repository, so their absence here does not show they are missing. Expected evidence was not found: any(agent.permissions).",
      "remediation": {
        "classification": "human-required",
        "decision": "Which tools, commands, and paths agents may use in this repository.",
        "summary": "Commit a project-level agent permission configuration with least-privilege defaults."
      },
      "required_for": [],
      "required_from": "optimized",
      "severity": "recommended",
      "status": "unknown",
      "title": "Agent permissions are configured in the repository",
      "unsupported_evidence": []
    },
    {
      "applicability": null,
      "depends_on": [
        "context.agent_instructions"
      ],
      "dimension": "security",
      "evidence": [
        {
          "line": 48,
          "source": "AGENTS.md",
          "type": "agent.instructions.secrets_policy",
          "value": "- Never commit secrets or `.env` files, and never print credentials in command output."
        }
      ],
      "id": "constraints.agent_secrets_policy",
      "missing_evidence": [],
      "pillar": "constraints",
      "reason": "Satisfied by agent.instructions.secrets_policy.",
      "remediation": {
        "classification": "assisted",
        "summary": "Add a secrets rule to the instruction file, for example never read or print `.env` files or credentials."
      },
      "required_for": [],
      "required_from": "structured",
      "severity": "advisory",
      "status": "pass",
      "title": "Instructions address secrets handling",
      "unsupported_evidence": []
    },
    {
      "applicability": {
        "expression": "any(project.language)",
        "observed": [
          "project.language"
        ],
        "result": "applicable"
      },
      "depends_on": [],
      "dimension": null,
      "evidence": [],
      "id": "constraints.architecture_boundaries",
      "missing_evidence": [
        "config.architecture_boundaries",
        "config.architecture_boundaries_declared"
      ],
      "pillar": "constraints",
      "reason": "Architecture boundaries are project/team policy. The absence of an enforcement configuration does not show that a repository has no boundaries, and they cannot be inferred safely from code. Expected evidence was not found: any(config.architecture_boundaries, config.architecture_boundaries_declared).",
      "remediation": {
        "classification": "human-required",
        "decision": "Which modules or layers may depend on which, and which dependencies are forbidden.",
        "summary": "Declare the boundaries in a dependency-enforcement tool so agents get feedback when they cross them."
      },
      "required_for": [
        "optimized",
        "autonomous"
      ],
      "required_from": "optimized",
      "severity": "required",
      "status": "unknown",
      "title": "Important architecture boundaries are explicit and machine-checkable",
      "unsupported_evidence": []
    },
    {
      "applicability": null,
      "depends_on": [
        "context.agent_instructions"
      ],
      "dimension": null,
      "evidence": [
        {
          "line": 41,
          "source": "AGENTS.md",
          "type": "agent.instructions.constraints",
          "value": "Do not"
        },
        {
          "line": 43,
          "source": "AGENTS.md",
          "type": "agent.instructions.prohibitions",
          "value": "- Do not add runtime dependencies to `pyproject.toml`; dev and test extras are fine."
        },
        {
          "line": 44,
          "source": "AGENTS.md",
          "type": "agent.instructions.prohibitions",
          "value": "- Do not run `ruff format` on the repository. Formatting is not adopted, and it would rewrite most files."
        },
        {
          "line": 45,
          "source": "AGENTS.md",
          "type": "agent.instructions.prohibitions",
          "value": "- Never remove or rename a contract field, document type, or listed exit code. That breaks"
        },
        {
          "line": 47,
          "source": "AGENTS.md",
          "type": "agent.instructions.prohibitions",
          "value": "- Never edit `src/agentic_dev/readiness/specs/` by hand. Use `scripts/sync-agent-ready-spec.py`."
        },
        {
          "line": 48,
          "source": "AGENTS.md",
          "type": "agent.instructions.prohibitions",
          "value": "- Never commit secrets or `.env` files, and never print credentials in command output."
        },
        {
          "line": 49,
          "source": "AGENTS.md",
          "type": "agent.instructions.prohibitions",
          "value": "- Do not let tests touch the real `~/.config` or a real repository; use temporary directories."
        },
        {
          "line": 50,
          "source": "AGENTS.md",
          "type": "agent.instructions.prohibitions",
          "value": "- Do not change the version in `pyproject.toml` or `src/agentic_dev/__init__.py` outside a release"
        }
      ],
      "id": "constraints.documented",
      "missing_evidence": [],
      "pillar": "constraints",
      "reason": "Satisfied by agent.instructions.constraints, agent.instructions.prohibitions.",
      "remediation": {
        "classification": "human-required",
        "decision": "Which files, areas, dependencies, and actions are off-limits for agents.",
        "summary": "Add a \"Do / Do NOT\" section to the agent instruction file."
      },
      "required_for": [
        "structured",
        "optimized",
        "autonomous"
      ],
      "required_from": "structured",
      "severity": "required",
      "status": "pass",
      "title": "Off-limits areas and prohibitions are stated",
      "unsupported_evidence": []
    },
    {
      "applicability": {
        "expression": "any(file.mcp_config)",
        "observed": [],
        "result": "not-applicable"
      },
      "depends_on": [],
      "dimension": "security",
      "evidence": [],
      "id": "constraints.mcp.no_inline_secrets",
      "missing_evidence": [],
      "pillar": "constraints",
      "reason": "Not applicable: requires any(file.mcp_config).",
      "remediation": {
        "classification": "human-required",
        "decision": "Which credentials were exposed and how to rotate them.",
        "summary": "Replace literal credentials with environment-variable references and rotate the exposed values."
      },
      "required_for": [
        "structured",
        "optimized",
        "autonomous"
      ],
      "required_from": "structured",
      "severity": "required",
      "status": "not-applicable",
      "title": "Committed MCP configuration has no inline secrets",
      "unsupported_evidence": []
    },
    {
      "applicability": {
        "expression": "any(project.language)",
        "observed": [
          "project.language"
        ],
        "result": "applicable"
      },
      "depends_on": [],